Country Name,Country Code,Indicator Name,Indicator Code,1960,1961,1962,1963,1964,1965,1966,1967,1968,1969,1970,1971,1972,1973,1974,1975,1976,1977,1978,1979,1980,1981,1982,1983,1984,1985,1986,1987,1988,1989,1990,1991,1992,1993,1994,1995,1996,1997,1998,1999,2000,2001,2002,2003,2004,2005,2006,2007,2008,2009,2010,2011,2012,2013,2014,2015,2016,2017,2018,2019,2020,2021,2022,2023
East Asia & Pacific,EAS,A woman can apply for a passport in the same way as a man (1=yes; 0=no),SG.APL.PSPT.EQ,,,,,,,,,,,,,,,,,,,,,,,,,,,,,,,,,,,,,,,,,,,,,,,,,,,,,,,,,,,,,,,,
East Asia & Pacific,EAS,"A woman can be ""head of household"" in the same way as a man (1=yes; 0=no)",SG.HLD.HEAD.EQ,,,,,,,,,,,,,,,,,,,,,,,,,,,,,,,,,,,,,,,,,,,,,,,,,,,,,,,,,,,,,,,,
East Asia & Pacific,EAS,A woman can choose where to live in the same way as a man (1=yes; 0=no),SG.LOC.LIVE.EQ,,,,,,,,,,,,,,,,,,,,,,,,,,,,,,,,,,,,,,,,,,,,,,,,,,,,,,,,,,,,,,,,
East Asia & Pacific,EAS,A woman can get a job in the same way as a man (1=yes; 0=no),SG.GET.JOBS.EQ,,,,,,,,,,,,,,,,,,,,,,,,,,,,,,,,,,,,,,,,,,,,,,,,,,,,,,,,,,,,,,,,
East Asia & Pacific,EAS,A woman can obtain a judgment of divorce in the same way as a man (1=yes; 0=no),SG.OBT.DVRC.EQ,,,,,,,,,,,,,,,,,,,,,,,,,,,,,,,,,,,,,,,,,,,,,,,,,,,,,,,,,,,,,,,,
East Asia & Pacific,EAS,A woman can open a bank account in the same way as a man (1=yes; 0=no),SG.OPN.BANK.EQ,,,,,,,,,,,,,,,,,,,,,,,,,,,,,,,,,,,,,,,,,,,,,,,,,,,,,,,,,,,,,,,,
East Asia & Pacific,EAS,A woman can register a business in the same way as a man (1=yes; 0=no),SG.BUS.REGT.EQ,,,,,,,,,,,,,,,,,,,,,,,,,,,,,,,,,,,,,,,,,,,,,,,,,,,,,,,,,,,,,,,,
East Asia & Pacific,EAS,A woman can sign a contract in the same way as a man (1=yes; 0=no),SG.CNT.SIGN.EQ,,,,,,,,,,,,,,,,,,,,,,,,,,,,,,,,,,,,,,,,,,,,,,,,,,,,,,,,,,,,,,,,
East Asia & Pacific,EAS,A woman can travel outside her home in the same way as a man (1=yes; 0=no),SG.HME.TRVL.EQ,,,,,,,,,,,,,,,,,,,,,,,,,,,,,,,,,,,,,,,,,,,,,,,,,,,,,,,,,,,,,,,,
East Asia & Pacific,EAS,A woman can travel outside the country in the same way as a man (1=yes; 0=no),SG.CTR.TRVL.EQ,,,,,,,,,,,,,,,,,,,,,,,,,,,,,,,,,,,,,,,,,,,,,,,,,,,,,,,,,,,,,,,,
East Asia & Pacific,EAS,A woman can work at night in the same way as a man (1=yes; 0=no),SG.NGT.WORK.EQ,,,,,,,,,,,,,,,,,,,,,,,,,,,,,,,,,,,,,,,,,,,,,,,,,,,,,,,,,,,,,,,,
East Asia & Pacific,EAS,A woman can work in a job deemed dangerous in the same way as a man (1=yes; 0=no),SG.DNG.WORK.DN.EQ,,,,,,,,,,,,,,,,,,,,,,,,,,,,,,,,,,,,,,,,,,,,,,,,,,,,,,,,,,,,,,,,
East Asia & Pacific,EAS,A woman can work in an industrial job in the same way as a man (1=yes; 0=no),SG.IND.WORK.EQ,,,,,,,,,,,,,,,,,,,,,,,,,,,,,,,,,,,,,,,,,,,,,,,,,,,,,,,,,,,,,,,,
East Asia & Pacific,EAS,A woman has the same rights to remarry as a man (1=yes; 0=no),SG.REM.RIGT.EQ,,,,,,,,,,,,,,,,,,,,,,,,,,,,,,,,,,,,,,,,,,,,,,,,,,,,,,,,,,,,,,,,
East Asia & Pacific,EAS,"Access to anti-retroviral drugs, female (%)",SH.HIV.ARTC.FE.ZS,,,,,,,,,,,,,,,,,,,,,,,,,,,,,,,,,,,,,,,,,,,,,,,,,,,,,,,,,,,,,,,,
East Asia & Pacific,EAS,"Access to anti-retroviral drugs, male (%)",SH.HIV.ARTC.MA.ZS,,,,,,,,,,,,,,,,,,,,,,,,,,,,,,,,,,,,,,,,,,,,,,,,,,,,,,,,,,,,,,,,
East Asia & Pacific,EAS,Account (% age 15+),account.t.d,,,,,,,,,,,,,,,,,,,,,,,,,,,,,,,,,,,,,,,,,,,,,,,,,,,,59.81,,,71.86,,,73.39,,,,82.85,,
East Asia & Pacific,EAS,"Account, female (% age 15+)",account.t.d.1,,,,,,,,,,,,,,,,,,,,,,,,,,,,,,,,,,,,,,,,,,,,,,,,,,,,57.5,,,70.24,,,71.17,,,,81.38,,
East Asia & Pacific,EAS,"Account, male (% age 15+)",account.t.d.2,,,,,,,,,,,,,,,,,,,,,,,,,,,,,,,,,,,,,,,,,,,,,,,,,,,,62.15,,,73.49,,,75.66,,,,84.24,,
East Asia & Pacific,EAS,"Adjusted net enrollment rate, primary (% of primary school age children)",SE.PRM.TENR,,,,,,,,,,,,,,,,,,,,,,,,,,,,,,,,,,,,,,,,,,,,,,,,,,,,,,95.70754,,,95.99079,96.06234,95.98306,,,,,
East Asia & Pacific,EAS,"Adjusted net enrollment rate, primary, female (% of primary school age children)",SE.PRM.TENR.FE,,,,,,,,,,,,,,,,,,,,,,,,,,,,,,,,,,,,,,,,,,,,,,,,,,,,,,95.8027,,,95.66091,95.68388,95.56074,,,,,
East Asia & Pacific,EAS,"Adjusted net enrollment rate, primary, male (% of primary school age children)",SE.PRM.TENR.MA,,,,,,,,,,,,,,,,,,,,,,,,,,,,,,,,,,,,,,,,,,,,,,,,,,,,,,,,,96.33873,96.41708,96.36167,,,,,
East Asia & Pacific,EAS,"Adolescent fertility rate (births per 1,000 women ages 15-19)",SP.ADO.TFRT,59.84825927547416,54.765509785966614,70.05371062309,79.63710246317524,70.91898388466765,67.15120122638321,61.05264104728766,53.57035191896482,57.498047052268575,53.9290566883239,52.53966811943934,48.56124055318245,44.95941229131381,42.67152097918565,40.68586608732721,38.6941709142677,38.353161529467435,35.55567352637399,31.75792226532469,28.968123322397147,27.70900794025118,29.648929637842315,34.577581412212204,34.97564954367372,35.85907663950761,35.20835633531545,34.63829752750594,35.39674070134029,34.31163392641797,33.31667734796208,30.734115776939586,28.24124486292005,26.48568435897817,24.9326757195704,22.32165819755864,22.353441237162116,21.089749073678156,19.860069425364284,18.28780174040417,18.65949982116442,18.568313591872748,18.33106423178342,17.862293052101304,17.670776724304698,16.769679688917858,17.04640165401581,18.47909848299813,19.34799271148693,20.98148015310911,22.16227153597945,22.996163186684555,23.200827081505363,23.76714467301413,23.40880186844507,23.038644960567936,21.947533416517977,20.993022579016365,19.856603355252325,18.21192853222824,17.261393652667365,15.878941119015558,15.197225339807346,14.80034274433348,
East Asia & Pacific,EAS,"Age at first marriage, female",SP.DYN.SMAM.FE,,,,,,,,,,,,,,,,,,,,,,,,,,,,,,,,,,,,,,,,,,,,,,,,,,,,,,,,,,,,,,,,
East Asia & Pacific,EAS,"Age at first marriage, male",SP.DYN.SMAM.MA,,,,,,,,,,,,,,,,,,,,,,,,,,,,,,,,,,,,,,,,,,,,,,,,,,,,,,,,,,,,,,,,
East Asia & Pacific,EAS,Age dependency ratio (% of working-age population),SP.POP.DPND,77.75290386357406,77.02868542748287,77.08749636886617,78.41380748478863,79.57673570012957,80.068880411649,80.24473591701073,79.89070297750236,79.5272745432951,79.31718779614746,78.92282813062381,78.56958154583673,77.99700741309991,77.41964286399794,77.36450828533796,77.39271820154468,77.30582621372092,76.1797662366502,73.53609654966277,70.87721369507184,68.70718908405767,66.78534665785719,65.25972005922502,63.53579386042916,61.591283008934255,59.86324426567212,58.391833861402695,57.25618169403398,56.29216537617474,55.57015305218893,55.218057171759575,54.90569399100006,54.50265462230176,54.13628656286043,53.70545301252919,53.17313460232684,52.52199738301456,51.69346521144987,50.89735600560899,50.16302174138579,49.3658070914592,48.47795278323921,47.43974535189064,46.39606734421126,45.38329856228261,44.35984596379684,43.59937367203245,43.16933379352028,42.86773901495993,42.65318775477738,42.504047344832706,42.48872739404128,42.67954277481082,43.012640112422986,43.43476097318836,43.9027061648034,44.42162772355106,45.09025951612215,45.73310409900434,46.25558157000887,46.68343784927212,46.89433574779083,46.989615850204856,46.95216248591225
East Asia & Pacific,EAS,"Age population, age 0, female, interpolated",SP.POP.AG00.FE.IN,,,,,,,,,,,,,,,,,,,,,,,,,,,,,,,,,,,,,,,,,,,,,,,,,,,,,,,,,,,,,,,,
East Asia & Pacific,EAS,"Age population, age 0, male, interpolated",SP.POP.AG00.MA.IN,,,,,,,,,,,,,,,,,,,,,,,,,,,,,,,,,,,,,,,,,,,,,,,,,,,,,,,,,,,,,,,,
East Asia & Pacific,EAS,"Age population, age 01, female, interpolated",SP.POP.AG01.FE.IN,,,,,,,,,,,,,,,,,,,,,,,,,,,,,,,,,,,,,,,,,,,,,,,,,,,,,,,,,,,,,,,,
East Asia & Pacific,EAS,"Age population, age 01, male, interpolated",SP.POP.AG01.MA.IN,,,,,,,,,,,,,,,,,,,,,,,,,,,,,,,,,,,,,,,,,,,,,,,,,,,,,,,,,,,,,,,,
East Asia & Pacific,EAS,"Age population, age 02, female, interpolated",SP.POP.AG02.FE.IN,,,,,,,,,,,,,,,,,,,,,,,,,,,,,,,,,,,,,,,,,,,,,,,,,,,,,,,,,,,,,,,,
East Asia & Pacific,EAS,"Age population, age 02, male, interpolated",SP.POP.AG02.MA.IN,,,,,,,,,,,,,,,,,,,,,,,,,,,,,,,,,,,,,,,,,,,,,,,,,,,,,,,,,,,,,,,,
East Asia & Pacific,EAS,"Age population, age 03, female, interpolated",SP.POP.AG03.FE.IN,,,,,,,,,,,,,,,,,,,,,,,,,,,,,,,,,,,,,,,,,,,,,,,,,,,,,,,,,,,,,,,,
East Asia & Pacific,EAS,"Age population, age 03, male, interpolated",SP.POP.AG03.MA.IN,,,,,,,,,,,,,,,,,,,,,,,,,,,,,,,,,,,,,,,,,,,,,,,,,,,,,,,,,,,,,,,,
East Asia & Pacific,EAS,"Age population, age 04, female, interpolated",SP.POP.AG04.FE.IN,,,,,,,,,,,,,,,,,,,,,,,,,,,,,,,,,,,,,,,,,,,,,,,,,,,,,,,,,,,,,,,,
East Asia & Pacific,EAS,"Age population, age 04, male, interpolated",SP.POP.AG04.MA.IN,,,,,,,,,,,,,,,,,,,,,,,,,,,,,,,,,,,,,,,,,,,,,,,,,,,,,,,,,,,,,,,,
East Asia & Pacific,EAS,"Age population, age 05, female, interpolated",SP.POP.AG05.FE.IN,,,,,,,,,,,,,,,,,,,,,,,,,,,,,,,,,,,,,,,,,,,,,,,,,,,,,,,,,,,,,,,,
East Asia & Pacific,EAS,"Age population, age 05, male, interpolated",SP.POP.AG05.MA.IN,,,,,,,,,,,,,,,,,,,,,,,,,,,,,,,,,,,,,,,,,,,,,,,,,,,,,,,,,,,,,,,,
East Asia & Pacific,EAS,Antiretroviral therapy coverage for PMTCT (% of pregnant women living with HIV),SH.HIV.PMTC.ZS,,,,,,,,,,,,,,,,,,,,,,,,,,,,,,,,,,,,,,,,,,,,,,,,,,,,,,,,,,,,,,,,
East Asia & Pacific,EAS,"Birth rate, crude (per 1,000 people)",SP.DYN.CBRT.IN,26.290485620181872,24.324964163425335,36.40200360405466,40.348952452250046,37.53193261650585,36.625749988947504,34.24281167034196,33.84070503031873,34.6530413444866,33.57326349928592,33.06778341381471,31.187019690937113,30.440841713586195,29.07705842119423,26.737391583869737,25.25673733623796,23.033379255727485,22.224170823100675,21.66153950738304,21.37745050823374,21.526769479714673,23.0985106577608,23.845134796990568,22.34273881368094,21.93515504416512,22.357319792058114,22.9503594337598,23.3649632851129,22.657828483188915,21.976594708471858,21.546963771857666,20.645022487291612,19.631609550576375,19.363963421730556,19.008801436923253,18.476394589073006,18.24572889638293,17.836674245574166,17.043768082740176,16.249182939375064,15.797471599535193,15.255205021664729,14.815556723380578,14.424302174657704,14.268830316470943,14.254230711870653,14.064658327520366,14.111681668450943,14.093545704344535,13.899288777738864,13.795279059325113,14.609343381111346,15.385783368594083,14.317162155149369,14.710079977742213,13.503358265438974,14.32281164178544,13.627007736578918,12.454642139715029,12.083268177680711,10.855271672591888,10.185018613444887,9.648792634929372,
East Asia & Pacific,EAS,Births attended by skilled health staff (% of total),SH.STA.BRTC.ZS,,,,,,,,,,,,,,,,,,,,,,,,,,,,,,,85.00626468748946,,,,,,,,,,85.26599207926746,,,,,,,,,,92.39386356796815,,,,,,,,,95.38519871333637,,,,
East Asia & Pacific,EAS,Borrowed any money (% age 15+),borrow.any,,,,,,,,,,,,,,,,,,,,,,,,,,,,,,,,,,,,,,,,,,,,,,,,,,,,,,,48.38,,,48.55,,,,54.65,,
East Asia & Pacific,EAS,Borrowed any money from a formal financial institution or using a mobile money account (% age 15+),fin22a.c.MM.d,,,,,,,,,,,,,,,,,,,,,,,,,,,,,,,,,,,,,,,,,,,,,,,,,,,,,,,,,,,,,,36.69,,
East Asia & Pacific,EAS,"Borrowed any money from a formal financial institution or using a mobile money account, female (% age 15+)",fin22a.c.MM.d.1,,,,,,,,,,,,,,,,,,,,,,,,,,,,,,,,,,,,,,,,,,,,,,,,,,,,,,,,,,,,,,36.21,,
East Asia & Pacific,EAS,"Borrowed any money from a formal financial institution or using a mobile money account, male (% age 15+)",fin22a.c.MM.d.2,,,,,,,,,,,,,,,,,,,,,,,,,,,,,,,,,,,,,,,,,,,,,,,,,,,,,,,,,,,,,,37.14,,
East Asia & Pacific,EAS,"Borrowed any money, female (% age 15+)",borrow.any.1,,,,,,,,,,,,,,,,,,,,,,,,,,,,,,,,,,,,,,,,,,,,,,,,,,,,,,,47.01,,,46.9,,,,51.99,,
East Asia & Pacific,EAS,"Borrowed any money, male (% age 15+)",borrow.any.2,,,,,,,,,,,,,,,,,,,,,,,,,,,,,,,,,,,,,,,,,,,,,,,,,,,,,,,49.74,,,50.23,,,,57.15,,
East Asia & Pacific,EAS,Borrowed for education or school fees (% age 15+),fin22a.2014,,,,,,,,,,,,,,,,,,,,,,,,,,,,,,,,,,,,,,,,,,,,,,,,,,,,,,,6.79,,,,,,,,,
East Asia & Pacific,EAS,"Borrowed for education or school fees, female (% age 15+)",fin22a.2014.1,,,,,,,,,,,,,,,,,,,,,,,,,,,,,,,,,,,,,,,,,,,,,,,,,,,,,,,6.81,,,,,,,,,
East Asia & Pacific,EAS,"Borrowed for education or school fees, male (% age 15+)",fin22a.2014.2,,,,,,,,,,,,,,,,,,,,,,,,,,,,,,,,,,,,,,,,,,,,,,,,,,,,,,,6.77,,,,,,,,,
East Asia & Pacific,EAS,Borrowed for health or medical purposes (% age 15+),fin20.t.d,,,,,,,,,,,,,,,,,,,,,,,,,,,,,,,,,,,,,,,,,,,,,,,,,,,,,,,9.38,,,7.43,,,,10.87,,
East Asia & Pacific,EAS,"Borrowed for health or medical purposes, female (% age 15+)",fin20.t.d.1,,,,,,,,,,,,,,,,,,,,,,,,,,,,,,,,,,,,,,,,,,,,,,,,,,,,,,,9.66,,,6.88,,,,8.67,,
East Asia & Pacific,EAS,"Borrowed for health or medical purposes, male (% age 15+)",fin20.t.d.2,,,,,,,,,,,,,,,,,,,,,,,,,,,,,,,,,,,,,,,,,,,,,,,,,,,,,,,9.09,,,7.98,,,,12.95,,
East Asia & Pacific,EAS,Borrowed from a formal financial institution (% age 15+),fin22a.c.t.d,,,,,,,,,,,,,,,,,,,,,,,,,,,,,,,,,,,,,,,,,,,,,,,,,,,,8.76,,,23.26,,,24.85,,,,36.43,,
East Asia & Pacific,EAS,"Borrowed from a formal financial institution, female (% age 15+)",fin22a.c.t.d.1,,,,,,,,,,,,,,,,,,,,,,,,,,,,,,,,,,,,,,,,,,,,,,,,,,,,7.74,,,22.53,,,23.5,,,,36.02,,
East Asia & Pacific,EAS,"Borrowed from a formal financial institution, male (% age 15+)",fin22a.c.t.d.2,,,,,,,,,,,,,,,,,,,,,,,,,,,,,,,,,,,,,,,,,,,,,,,,,,,,9.8,,,23.99,,,26.22,,,,36.82,,
East Asia & Pacific,EAS,Borrowed from a savings club (% age 15+),fin22c.t.d,,,,,,,,,,,,,,,,,,,,,,,,,,,,,,,,,,,,,,,,,,,,,,,,,,,,,,,,,,,,,,,,
East Asia & Pacific,EAS,"Borrowed from a savings club, female (% age 15+)",fin22c.t.d.1,,,,,,,,,,,,,,,,,,,,,,,,,,,,,,,,,,,,,,,,,,,,,,,,,,,,,,,,,,,,,,,,
East Asia & Pacific,EAS,"Borrowed from a savings club, male (% age 15+)",fin22c.t.d.2,,,,,,,,,,,,,,,,,,,,,,,,,,,,,,,,,,,,,,,,,,,,,,,,,,,,,,,,,,,,,,,,
East Asia & Pacific,EAS,Borrowed from a store by buying on credit (% age 15+),fin21b.2014,,,,,,,,,,,,,,,,,,,,,,,,,,,,,,,,,,,,,,,,,,,,,,,,,,,,4.95,,,4.64,,,,,,,,,
East Asia & Pacific,EAS,"Borrowed from a store by buying on credit, female (% age 15+)",fin21b.2014.1,,,,,,,,,,,,,,,,,,,,,,,,,,,,,,,,,,,,,,,,,,,,,,,,,,,,4.76,,,4.88,,,,,,,,,
East Asia & Pacific,EAS,"Borrowed from a store by buying on credit, male (% age 15+)",fin21b.2014.2,,,,,,,,,,,,,,,,,,,,,,,,,,,,,,,,,,,,,,,,,,,,,,,,,,,,5.13,,,4.41,,,,,,,,,
East Asia & Pacific,EAS,Borrowed from family or friends (% age 15+),fin22b.t.d,,,,,,,,,,,,,,,,,,,,,,,,,,,,,,,,,,,,,,,,,,,,,,,,,,,,25.03,,,26.32,,,27.84,,,,25.33,,
East Asia & Pacific,EAS,"Borrowed from family or friends, female (% age 15+)",fin22b.t.d.1,,,,,,,,,,,,,,,,,,,,,,,,,,,,,,,,,,,,,,,,,,,,,,,,,,,,23.96,,,25.32,,,26.95,,,,21.13,,
East Asia & Pacific,EAS,"Borrowed from family or friends, male (% age 15+)",fin22b.t.d.2,,,,,,,,,,,,,,,,,,,,,,,,,,,,,,,,,,,,,,,,,,,,,,,,,,,,26.12,,,27.31,,,28.76,,,,29.28,,
East Asia & Pacific,EAS,"Borrowed to start, operate, or expand a farm or business (% age 15+)",fin21.t.d.2017,,,,,,,,,,,,,,,,,,,,,,,,,,,,,,,,,,,,,,,,,,,,,,,,,,,,,,,7.64,,,6.81,,,,,,
East Asia & Pacific,EAS,"Borrowed to start, operate, or expand a farm or business, female (% age 15+)",fin21.t.d.2017.1,,,,,,,,,,,,,,,,,,,,,,,,,,,,,,,,,,,,,,,,,,,,,,,,,,,,,,,6.86,,,5.6,,,,,,
East Asia & Pacific,EAS,"Borrowed to start, operate, or expand a farm or business, male (% age 15+)",fin21.t.d.2017.2,,,,,,,,,,,,,,,,,,,,,,,,,,,,,,,,,,,,,,,,,,,,,,,,,,,,,,,8.43,,,8.05,,,,,,
East Asia & Pacific,EAS,"Can use a mobile money account without help from anyone, including a mobile money agent (% age 15+)",fin13d,,,,,,,,,,,,,,,,,,,,,,,,,,,,,,,,,,,,,,,,,,,,,,,,,,,,,,,,,,,,,,,,
East Asia & Pacific,EAS,"Can use a mobile money account without help from anyone, including a mobile money agent (% with a mobile money account, age 15+)",fin13d.s,,,,,,,,,,,,,,,,,,,,,,,,,,,,,,,,,,,,,,,,,,,,,,,,,,,,,,,,,,,,,,,,
East Asia & Pacific,EAS,"Can use account at a bank or financial institution without help if opened (% without an account, age 15+)",fin11.1,,,,,,,,,,,,,,,,,,,,,,,,,,,,,,,,,,,,,,,,,,,,,,,,,,,,,,,,,,,,,,,,
East Asia & Pacific,EAS,"Cause of death, by communicable diseases and maternal, prenatal and nutrition conditions (% of total)",SH.DTH.COMM.ZS,,,,,,,,,,,,,,,,,,,,,,,,,,,,,,,,,,,,,,,,,15.904661071905956,,,,,,,,,,10.858507424119349,,,,,9.56658723634387,,,,8.420322216559736,,,,
East Asia & Pacific,EAS,"Cause of death, by communicable diseases and maternal, prenatal and nutrition conditions, ages 0-4 (% of population ages 0-4)",SH.DTH.COMM.0004.ZS,,,,,,,,,,,,,,,,,,,,,,,,,,,,,,,,,,,,,,,,,74.8423968585346,,,,,,,,,,71.60997249719968,,,,,70.49503999014435,,,,70.64114250840582,,,,
East Asia & Pacific,EAS,"Cause of death, by communicable diseases and maternal, prenatal and nutrition conditions, ages 0-4, female (% of female population ages 0-4)",SH.DTH.COMM.0004.FE.ZS,,,,,,,,,,,,,,,,,,,,,,,,,,,,,,,,,,,,,,,,,75.12441777465443,,,,,,,,,,72.04370826159807,,,,,70.78741340936023,,,,71.05787144397209,,,,
East Asia & Pacific,EAS,"Cause of death, by communicable diseases and maternal, prenatal and nutrition conditions, ages 0-4, male (% of male population ages 0-4)",SH.DTH.COMM.0004.MA.ZS,,,,,,,,,,,,,,,,,,,,,,,,,,,,,,,,,,,,,,,,,74.62027236865343,,,,,,,,,,71.27932845458312,,,,,70.27180966371712,,,,70.32295905648941,,,,
East Asia & Pacific,EAS,"Cause of death, by communicable diseases and maternal, prenatal and nutrition conditions, ages 15-59 (% of population ages 15-59)",SH.DTH.COMM.1559.ZS,,,,,,,,,,,,,,,,,,,,,,,,,,,,,,,,,,,,,,,,,14.383975873295416,,,,,,,,,,11.706909085084105,,,,,10.650430284512254,,,,9.465107384839808,,,,
East Asia & Pacific,EAS,"Cause of death, by communicable diseases and maternal, prenatal and nutrition conditions, ages 15-59, female (% of female population ages 15-59)",SH.DTH.COMM.1559.FE.ZS,,,,,,,,,,,,,,,,,,,,,,,,,,,,,,,,,,,,,,,,,15.73837128798366,,,,,,,,,,13.414133098402262,,,,,12.328322247949703,,,,11.153307095860589,,,,
East Asia & Pacific,EAS,"Cause of death, by communicable diseases and maternal, prenatal and nutrition conditions, ages 15-59, male (% of male population ages 15-59)",SH.DTH.COMM.1559.MA.ZS,,,,,,,,,,,,,,,,,,,,,,,,,,,,,,,,,,,,,,,,,13.57415304128403,,,,,,,,,,10.847551488669502,,,,,9.83331182465649,,,,8.634269572680983,,,,
East Asia & Pacific,EAS,"Cause of death, by communicable diseases and maternal, prenatal and nutrition conditions, ages 5-14 (% of population ages 5-14)",SH.DTH.COMM.0514.ZS,,,,,,,,,,,,,,,,,,,,,,,,,,,,,,,,,,,,,,,,,38.03147258816049,,,,,,,,,,38.185624394513,,,,,33.74075282547549,,,,33.38970931445576,,,,
East Asia & Pacific,EAS,"Cause of death, by communicable diseases and maternal, prenatal and nutrition conditions, ages 5-14, female (% of female population ages 5-14)",SH.DTH.COMM.0514.FE.ZS,,,,,,,,,,,,,,,,,,,,,,,,,,,,,,,,,,,,,,,,,42.43361269748555,,,,,,,,,,44.563018672652525,,,,,39.19835142787928,,,,39.251896898932685,,,,
East Asia & Pacific,EAS,"Cause of death, by communicable diseases and maternal, prenatal and nutrition conditions, ages 5-14, male (% of male population ages 5-14)",SH.DTH.COMM.0514.MA.ZS,,,,,,,,,,,,,,,,,,,,,,,,,,,,,,,,,,,,,,,,,34.533951033208496,,,,,,,,,,33.72287511685546,,,,,30.06289197838959,,,,29.40280747196689,,,,
East Asia & Pacific,EAS,"Cause of death, by communicable diseases and maternal, prenatal and nutrition conditions, ages 60+ (% of population ages 60+)",SH.DTH.COMM.60UP.ZS,,,,,,,,,,,,,,,,,,,,,,,,,,,,,,,,,,,,,,,,,7.519585834757597,,,,,,,,,,6.193293818638052,,,,,6.156463225426591,,,,5.850049518589337,,,,
East Asia & Pacific,EAS,"Cause of death, by communicable diseases and maternal, prenatal and nutrition conditions, ages 60+, female (% of female population ages 60+)",SH.DTH.COMM.60UP.FE.ZS,,,,,,,,,,,,,,,,,,,,,,,,,,,,,,,,,,,,,,,,,7.50363320611704,,,,,,,,,,6.425902015709273,,,,,6.521610462269949,,,,6.15358006916488,,,,
East Asia & Pacific,EAS,"Cause of death, by communicable diseases and maternal, prenatal and nutrition conditions, ages 60+, male (% of male population ages 60+)",SH.DTH.COMM.60UP.MA.ZS,,,,,,,,,,,,,,,,,,,,,,,,,,,,,,,,,,,,,,,,,7.533694753295073,,,,,,,,,,5.997006918080962,,,,,5.854850921220072,,,,5.593710050421207,,,,
East Asia & Pacific,EAS,"Cause of death, by communicable diseases and maternal, prenatal and nutrition conditions, female (% of female population)",SH.DTH.COMM.FE.ZS,,,,,,,,,,,,,,,,,,,,,,,,,,,,,,,,,,,,,,,,,16.001301703146556,,,,,,,,,,11.182270966293125,,,,,10.000009946874613,,,,8.799424849289498,,,,
East Asia & Pacific,EAS,"Cause of death, by communicable diseases and maternal, prenatal and nutrition conditions, male (% of male population)",SH.DTH.COMM.MA.ZS,,,,,,,,,,,,,,,,,,,,,,,,,,,,,,,,,,,,,,,,,15.828266763869086,,,,,,,,,,10.618267507723818,,,,,9.248146719788949,,,,8.133734554733515,,,,
East Asia & Pacific,EAS,"Cause of death, by injury (% of total)",SH.DTH.INJR.ZS,,,,,,,,,,,,,,,,,,,,,,,,,,,,,,,,,,,,,,,,,9.018209092558363,,,,,,,,,,8.09088339359709,,,,,7.248329659742397,,,,6.6763519176949675,,,,
East Asia & Pacific,EAS,"Cause of death, by injury, ages 0-4 (% of population ages 0-4)",SH.DTH.INJR.0004.ZS,,,,,,,,,,,,,,,,,,,,,,,,,,,,,,,,,,,,,,,,,10.29103291517882,,,,,,,,,,8.34284049965212,,,,,8.455732234192814,,,,8.212905074503588,,,,
East Asia & Pacific,EAS,"Cause of death, by injury, ages 0-4, female (% of female population ages 0-4)",SH.DTH.INJR.0004.FE.ZS,,,,,,,,,,,,,,,,,,,,,,,,,,,,,,,,,,,,,,,,,10.07091850248514,,,,,,,,,,8.177193721130891,,,,,8.423969847071797,,,,8.10762910020354,,,,
East Asia & Pacific,EAS,"Cause of death, by injury, ages 0-4, male (% of male population ages 0-4)",SH.DTH.INJR.0004.MA.ZS,,,,,,,,,,,,,,,,,,,,,,,,,,,,,,,,,,,,,,,,,10.464398785717798,,,,,,,,,,8.469115815287974,,,,,8.479983166639363,,,,8.293286037040362,,,,
East Asia & Pacific,EAS,"Cause of death, by injury, ages 15-59 (% of population ages 15-59)",SH.DTH.INJR.1559.ZS,,,,,,,,,,,,,,,,,,,,,,,,,,,,,,,,,,,,,,,,,20.741763980857375,,,,,,,,,,19.629199859627377,,,,,17.98267025255119,,,,17.11148365992649,,,,
East Asia & Pacific,EAS,"Cause of death, by injury, ages 15-59, female (% of female population ages 15-59)",SH.DTH.INJR.1559.FE.ZS,,,,,,,,,,,,,,,,,,,,,,,,,,,,,,,,,,,,,,,,,15.979815155137311,,,,,,,,,,13.32353990312648,,,,,11.847435164774708,,,,11.030377891249158,,,,
East Asia & Pacific,EAS,"Cause of death, by injury, ages 15-59, male (% of male population ages 15-59)",SH.DTH.INJR.1559.MA.ZS,,,,,,,,,,,,,,,,,,,,,,,,,,,,,,,,,,,,,,,,,23.58903800597644,,,,,,,,,,22.803251268134236,,,,,20.970475161881065,,,,20.104265011123353,,,,
East Asia & Pacific,EAS,"Cause of death, by injury, ages 5-14 (% of population ages 5-14)",SH.DTH.INJR.0514.ZS,,,,,,,,,,,,,,,,,,,,,,,,,,,,,,,,,,,,,,,,,37.84123477993698,,,,,,,,,,36.33277627981652,,,,,37.33223836143058,,,,35.889991889500976,,,,
East Asia & Pacific,EAS,"Cause of death, by injury, ages 5-14, female (% of female population ages 5-14)",SH.DTH.INJR.0514.FE.ZS,,,,,,,,,,,,,,,,,,,,,,,,,,,,,,,,,,,,,,,,,30.80321633078531,,,,,,,,,,27.69690998831093,,,,,28.62680708899639,,,,27.43523200619715,,,,
East Asia & Pacific,EAS,"Cause of death, by injury, ages 5-14, male (% of male population ages 5-14)",SH.DTH.INJR.0514.MA.ZS,,,,,,,,,,,,,,,,,,,,,,,,,,,,,,,,,,,,,,,,,43.432974392730905,,,,,,,,,,42.398625258942154,,,,,43.21918633157374,,,,41.64787665809346,,,,
East Asia & Pacific,EAS,"Cause of death, by injury, ages 60+ (% of population ages 60+)",SH.DTH.INJR.60UP.ZS,,,,,,,,,,,,,,,,,,,,,,,,,,,,,,,,,,,,,,,,,3.31780272973889,,,,,,,,,,3.702118021767105,,,,,3.683648050878352,,,,3.6011162831981767,,,,
East Asia & Pacific,EAS,"Cause of death, by injury, ages 60+, female (% of female population ages 60+)",SH.DTH.INJR.60UP.FE.ZS,,,,,,,,,,,,,,,,,,,,,,,,,,,,,,,,,,,,,,,,,3.060625368693293,,,,,,,,,,3.4739252644917955,,,,,3.4456453602215835,,,,3.3828370205246068,,,,
East Asia & Pacific,EAS,"Cause of death, by injury, ages 60+, male (% of male population ages 60+)",SH.DTH.INJR.60UP.MA.ZS,,,,,,,,,,,,,,,,,,,,,,,,,,,,,,,,,,,,,,,,,3.545257058024465,,,,,,,,,,3.894678944494157,,,,,3.880238720875367,,,,3.785458814784413,,,,
East Asia & Pacific,EAS,"Cause of death, by injury, female (% of female population)",SH.DTH.INJR.FE.ZS,,,,,,,,,,,,,,,,,,,,,,,,,,,,,,,,,,,,,,,,,6.973341065729718,,,,,,,,,,5.785618281538812,,,,,5.22114423805203,,,,4.832557389947937,,,,
East Asia & Pacific,EAS,"Cause of death, by injury, male (% of male population)",SH.DTH.INJR.MA.ZS,,,,,,,,,,,,,,,,,,,,,,,,,,,,,,,,,,,,,,,,,10.634674920618036,,,,,,,,,,9.801442569158455,,,,,8.737725478496957,,,,8.070192838319876,,,,
East Asia & Pacific,EAS,"Cause of death, by non-communicable diseases (% of total)",SH.DTH.NCOM.ZS,,,,,,,,,,,,,,,,,,,,,,,,,,,,,,,,,,,,,,,,,75.07712868635271,,,,,,,,,,81.05060921378383,,,,,83.18508399550629,,,,84.90332615749983,,,,
East Asia & Pacific,EAS,"Cause of death, by non-communicable diseases, ages 0-4 (% of population ages 0-4)",SH.DTH.NCOM.0004.ZS,,,,,,,,,,,,,,,,,,,,,,,,,,,,,,,,,,,,,,,,,14.86656974296868,,,,,,,,,,20.04718688440269,,,,,21.049228930911717,,,,21.14595203021868,,,,
East Asia & Pacific,EAS,"Cause of death, by non-communicable diseases, ages 0-4, female (% of female population ages 0-4)",SH.DTH.NCOM.0004.FE.ZS,,,,,,,,,,,,,,,,,,,,,,,,,,,,,,,,,,,,,,,,,14.804662568112615,,,,,,,,,,19.779098871560848,,,,,20.78861825813471,,,,20.83449918426116,,,,
East Asia & Pacific,EAS,"Cause of death, by non-communicable diseases, ages 0-4, male (% of male population ages 0-4)",SH.DTH.NCOM.0004.MA.ZS,,,,,,,,,,,,,,,,,,,,,,,,,,,,,,,,,,,,,,,,,14.915328891098616,,,,,,,,,,20.251554869999612,,,,,21.248208050450764,,,,21.383754431922736,,,,
East Asia & Pacific,EAS,"Cause of death, by non-communicable diseases, ages 15-59 (% of population ages 15-59)",SH.DTH.NCOM.1559.ZS,,,,,,,,,,,,,,,,,,,,,,,,,,,,,,,,,,,,,,,,,64.87426150882595,,,,,,,,,,68.66389179222686,,,,,71.36690196442636,,,,73.42340947698462,,,,
East Asia & Pacific,EAS,"Cause of death, by non-communicable diseases, ages 15-59, female (% of female population ages 15-59)",SH.DTH.NCOM.1559.FE.ZS,,,,,,,,,,,,,,,,,,,,,,,,,,,,,,,,,,,,,,,,,68.28181940665603,,,,,,,,,,73.26232135707296,,,,,75.82424642046395,,,,77.81631577020282,,,,
