Country Name,Country Code,Indicator Name,Indicator Code,1960,1961,1962,1963,1964,1965,1966,1967,1968,1969,1970,1971,1972,1973,1974,1975,1976,1977,1978,1979,1980,1981,1982,1983,1984,1985,1986,1987,1988,1989,1990,1991,1992,1993,1994,1995,1996,1997,1998,1999,2000,2001,2002,2003,2004,2005,2006,2007,2008,2009,2010,2011,2012,2013,2014,2015,2016,2017,2018,2019,2020,2021,2022,2023
Small states,SST,A woman can apply for a passport in the same way as a man (1=yes; 0=no),SG.APL.PSPT.EQ,,,,,,,,,,,,,,,,,,,,,,,,,,,,,,,,,,,,,,,,,,,,,,,,,,,,,,,,,,,,,,,,
Small states,SST,"A woman can be ""head of household"" in the same way as a man (1=yes; 0=no)",SG.HLD.HEAD.EQ,,,,,,,,,,,,,,,,,,,,,,,,,,,,,,,,,,,,,,,,,,,,,,,,,,,,,,,,,,,,,,,,
Small states,SST,A woman can choose where to live in the same way as a man (1=yes; 0=no),SG.LOC.LIVE.EQ,,,,,,,,,,,,,,,,,,,,,,,,,,,,,,,,,,,,,,,,,,,,,,,,,,,,,,,,,,,,,,,,
Small states,SST,A woman can get a job in the same way as a man (1=yes; 0=no),SG.GET.JOBS.EQ,,,,,,,,,,,,,,,,,,,,,,,,,,,,,,,,,,,,,,,,,,,,,,,,,,,,,,,,,,,,,,,,
Small states,SST,A woman can obtain a judgment of divorce in the same way as a man (1=yes; 0=no),SG.OBT.DVRC.EQ,,,,,,,,,,,,,,,,,,,,,,,,,,,,,,,,,,,,,,,,,,,,,,,,,,,,,,,,,,,,,,,,
Small states,SST,A woman can open a bank account in the same way as a man (1=yes; 0=no),SG.OPN.BANK.EQ,,,,,,,,,,,,,,,,,,,,,,,,,,,,,,,,,,,,,,,,,,,,,,,,,,,,,,,,,,,,,,,,
Small states,SST,A woman can register a business in the same way as a man (1=yes; 0=no),SG.BUS.REGT.EQ,,,,,,,,,,,,,,,,,,,,,,,,,,,,,,,,,,,,,,,,,,,,,,,,,,,,,,,,,,,,,,,,
Small states,SST,A woman can sign a contract in the same way as a man (1=yes; 0=no),SG.CNT.SIGN.EQ,,,,,,,,,,,,,,,,,,,,,,,,,,,,,,,,,,,,,,,,,,,,,,,,,,,,,,,,,,,,,,,,
Small states,SST,A woman can travel outside her home in the same way as a man (1=yes; 0=no),SG.HME.TRVL.EQ,,,,,,,,,,,,,,,,,,,,,,,,,,,,,,,,,,,,,,,,,,,,,,,,,,,,,,,,,,,,,,,,
Small states,SST,A woman can travel outside the country in the same way as a man (1=yes; 0=no),SG.CTR.TRVL.EQ,,,,,,,,,,,,,,,,,,,,,,,,,,,,,,,,,,,,,,,,,,,,,,,,,,,,,,,,,,,,,,,,
Small states,SST,A woman can work at night in the same way as a man (1=yes; 0=no),SG.NGT.WORK.EQ,,,,,,,,,,,,,,,,,,,,,,,,,,,,,,,,,,,,,,,,,,,,,,,,,,,,,,,,,,,,,,,,
Small states,SST,A woman can work in a job deemed dangerous in the same way as a man (1=yes; 0=no),SG.DNG.WORK.DN.EQ,,,,,,,,,,,,,,,,,,,,,,,,,,,,,,,,,,,,,,,,,,,,,,,,,,,,,,,,,,,,,,,,
Small states,SST,A woman can work in an industrial job in the same way as a man (1=yes; 0=no),SG.IND.WORK.EQ,,,,,,,,,,,,,,,,,,,,,,,,,,,,,,,,,,,,,,,,,,,,,,,,,,,,,,,,,,,,,,,,
Small states,SST,A woman has the same rights to remarry as a man (1=yes; 0=no),SG.REM.RIGT.EQ,,,,,,,,,,,,,,,,,,,,,,,,,,,,,,,,,,,,,,,,,,,,,,,,,,,,,,,,,,,,,,,,
Small states,SST,"Access to anti-retroviral drugs, female (%)",SH.HIV.ARTC.FE.ZS,,,,,,,,,,,,,,,,,,,,,,,,,,,,,,,,,,,,,,,,,,,,,,,,,,,,,,,,,,,,,,,,
Small states,SST,"Access to anti-retroviral drugs, male (%)",SH.HIV.ARTC.MA.ZS,,,,,,,,,,,,,,,,,,,,,,,,,,,,,,,,,,,,,,,,,,,,,,,,,,,,,,,,,,,,,,,,
Small states,SST,Account (% age 15+),account.t.d,,,,,,,,,,,,,,,,,,,,,,,,,,,,,,,,,,,,,,,,,,,,,,,,,,,,,,,,,,,,,,,,
Small states,SST,"Account, female (% age 15+)",account.t.d.1,,,,,,,,,,,,,,,,,,,,,,,,,,,,,,,,,,,,,,,,,,,,,,,,,,,,,,,,,,,,,,,,
Small states,SST,"Account, male (% age 15+)",account.t.d.2,,,,,,,,,,,,,,,,,,,,,,,,,,,,,,,,,,,,,,,,,,,,,,,,,,,,,,,,,,,,,,,,
Small states,SST,"Adjusted net enrollment rate, primary (% of primary school age children)",SE.PRM.TENR,,,,,,,,,,,,,,,,,,,,,,,,,,,,,,,,,,,,,,,,,81.03573,,,82.62375,83.03622,83.22746,83.93597,84.14618,84.14894,84.23941,84.88126,85.36996,85.30382,85.64914,85.55924,85.93655,85.52739,85.89277,86.06507,,,,,
Small states,SST,"Adjusted net enrollment rate, primary, female (% of primary school age children)",SE.PRM.TENR.FE,,,,,,,,,,,,,,,,,,,,,,,,,,,,,,,,,,,,,,,,,80.58657,,,,,83.42801,84.19719,84.46493,84.63899,84.72175,85.35784,85.76559,85.8822,86.2744,86.29308,86.65204,86.09795,86.46551,86.64325,,,,,
Small states,SST,"Adjusted net enrollment rate, primary, male (% of primary school age children)",SE.PRM.TENR.MA,,,,,,,,,,,,,,,,,,,,,,,,,,,,,,,,,,,,,,,,,81.56961,,,,,83.17072,83.86247,84.00953,83.86408,83.94946,84.55138,85.08683,84.86236,85.16894,84.98902,85.36175,85.07599,85.45634,85.61062,,,,,
Small states,SST,"Adolescent fertility rate (births per 1,000 women ages 15-19)",SP.ADO.TFRT,93.69596512916914,91.44680640978598,90.38658008708232,88.24302829310732,85.01436290171587,83.38359150548942,83.63265387275963,82.66357084439647,82.0846175015064,80.96473860786367,80.17830841255288,79.61422898724639,79.46037157632895,78.41053692368452,79.16086350426727,78.79981510124556,79.03013856700031,78.68059057312355,78.74667387786276,78.72370630799404,78.24345912020915,79.33849915645655,79.86059198067751,80.27583705541977,79.7775237436952,78.4943338184644,76.90785203765753,75.9435772605115,74.73014692837067,74.47034406045705,74.24377489903765,72.71147448024006,71.46210028748513,69.30871707347755,66.86014682193945,64.8254828655872,62.766937112529746,60.317721290927935,59.07775990660391,58.19364378557247,57.6357064351004,56.15399238156207,54.27786625259842,52.568859864715805,51.4379315575164,50.17532400313019,48.73825931375709,48.03020092264524,47.22076295317229,46.42393603728992,45.20850709445064,44.38800990238102,43.518726537459905,42.67384633369078,41.28161092457534,39.838430313390546,38.805528814070755,37.73495008372882,36.87379621683636,35.76812626994909,34.697304685572945,33.77328856350528,33.317990040088254,
Small states,SST,"Age at first marriage, female",SP.DYN.SMAM.FE,,,,,,,,,,,,,,,,,,,,,,,,,,,,,,,,,,,,,,,,,,,,,,,,,,,,,,,,,,,,,,,,
Small states,SST,"Age at first marriage, male",SP.DYN.SMAM.MA,,,,,,,,,,,,,,,,,,,,,,,,,,,,,,,,,,,,,,,,,,,,,,,,,,,,,,,,,,,,,,,,
Small states,SST,Age dependency ratio (% of working-age population),SP.POP.DPND,81.79415242903794,82.29826306558418,82.7794645617407,83.17267490104352,83.35991864885622,83.51180816494676,83.63923100366512,83.63234334985863,83.49658831878723,83.18938236440964,82.66648906824634,82.0068793191835,81.24426996150427,80.32022243481032,79.39048218906544,78.49443041702003,77.57724327638529,76.6395251892869,75.72349032801864,74.9390452117465,74.243246246763,73.56512711842255,72.94899904823122,72.44829225247128,72.04477418466014,71.73534792254326,71.53077709894815,71.38265926394914,71.20508760465611,71.0560237151117,70.95157539018022,70.7824909828743,70.49974527672651,70.26090014853366,70.15585226688881,69.8343801798984,69.1473133027144,68.26588646752127,67.21324254376387,65.9083536094769,64.68648337855444,63.739142993193454,62.76431543787345,61.777675493402135,60.757923761801216,59.790466440766224,58.89513396627515,57.98126161809684,57.101638401413496,56.30120652926854,55.681117214330214,55.278882905478376,54.84340032777445,54.50398242712746,54.26130306696446,53.953864319427005,53.59184867482773,53.20486380995313,52.868595102268976,52.63736576786978,52.42555903525499,52.05375056685603,51.71975732218721,51.442655875999385
Small states,SST,"Age population, age 0, female, interpolated",SP.POP.AG00.FE.IN,,,,,,,,,,,,,,,,,,,,,,,,,,,,,,,,,,,,,,,,,,,,,,,,,,,,,,,,,,,,,,,,
Small states,SST,"Age population, age 0, male, interpolated",SP.POP.AG00.MA.IN,,,,,,,,,,,,,,,,,,,,,,,,,,,,,,,,,,,,,,,,,,,,,,,,,,,,,,,,,,,,,,,,
Small states,SST,"Age population, age 01, female, interpolated",SP.POP.AG01.FE.IN,,,,,,,,,,,,,,,,,,,,,,,,,,,,,,,,,,,,,,,,,,,,,,,,,,,,,,,,,,,,,,,,
Small states,SST,"Age population, age 01, male, interpolated",SP.POP.AG01.MA.IN,,,,,,,,,,,,,,,,,,,,,,,,,,,,,,,,,,,,,,,,,,,,,,,,,,,,,,,,,,,,,,,,
Small states,SST,"Age population, age 02, female, interpolated",SP.POP.AG02.FE.IN,,,,,,,,,,,,,,,,,,,,,,,,,,,,,,,,,,,,,,,,,,,,,,,,,,,,,,,,,,,,,,,,
Small states,SST,"Age population, age 02, male, interpolated",SP.POP.AG02.MA.IN,,,,,,,,,,,,,,,,,,,,,,,,,,,,,,,,,,,,,,,,,,,,,,,,,,,,,,,,,,,,,,,,
Small states,SST,"Age population, age 03, female, interpolated",SP.POP.AG03.FE.IN,,,,,,,,,,,,,,,,,,,,,,,,,,,,,,,,,,,,,,,,,,,,,,,,,,,,,,,,,,,,,,,,
Small states,SST,"Age population, age 03, male, interpolated",SP.POP.AG03.MA.IN,,,,,,,,,,,,,,,,,,,,,,,,,,,,,,,,,,,,,,,,,,,,,,,,,,,,,,,,,,,,,,,,
Small states,SST,"Age population, age 04, female, interpolated",SP.POP.AG04.FE.IN,,,,,,,,,,,,,,,,,,,,,,,,,,,,,,,,,,,,,,,,,,,,,,,,,,,,,,,,,,,,,,,,
Small states,SST,"Age population, age 04, male, interpolated",SP.POP.AG04.MA.IN,,,,,,,,,,,,,,,,,,,,,,,,,,,,,,,,,,,,,,,,,,,,,,,,,,,,,,,,,,,,,,,,
Small states,SST,"Age population, age 05, female, interpolated",SP.POP.AG05.FE.IN,,,,,,,,,,,,,,,,,,,,,,,,,,,,,,,,,,,,,,,,,,,,,,,,,,,,,,,,,,,,,,,,
Small states,SST,"Age population, age 05, male, interpolated",SP.POP.AG05.MA.IN,,,,,,,,,,,,,,,,,,,,,,,,,,,,,,,,,,,,,,,,,,,,,,,,,,,,,,,,,,,,,,,,
Small states,SST,Antiretroviral therapy coverage for PMTCT (% of pregnant women living with HIV),SH.HIV.PMTC.ZS,,,,,,,,,,,,,,,,,,,,,,,,,,,,,,,,,,,,,,,,,,,,,,,,,,,,,,,,,,,,,,,,
Small states,SST,"Birth rate, crude (per 1,000 people)",SP.DYN.CBRT.IN,36.53357320812051,36.027455972969086,35.59922252368342,35.201388983272295,34.58690741699357,33.769172420641006,33.32743524047491,32.41138754197928,32.20309000925403,31.688450183122576,31.440128287929376,31.24935591419919,30.901812793950445,30.14355175523108,30.334945705439537,29.989324427330587,30.094288683655456,29.932431325267693,29.99210857592539,30.09414107948183,30.129517574269947,30.028312304766978,29.960711638061305,29.859646143159605,29.64328094575369,29.271856693421967,29.068226457894895,28.95073916658086,28.84084019516091,28.599509265852586,28.243393270830342,27.67169810378141,27.447432772069668,26.70418981337648,26.039114531345373,25.35426677578632,24.932324623919676,24.342799552319377,23.913117997774428,23.502958329227276,23.150649418049777,22.79869655091463,22.585715113221024,22.34408897106806,22.15277824264685,21.864266559852176,21.516289140129597,21.287628264080137,21.165573534413575,20.88507679801122,20.450373608496243,20.164587647484765,19.94967633354465,19.59390242071236,19.40926797209663,19.10743243547819,18.827943873625657,18.436633467620524,18.085472014602807,17.761046197328202,17.48532259781402,17.26504415959227,16.820531299699397,
Small states,SST,Births attended by skilled health staff (% of total),SH.STA.BRTC.ZS,,,,,,,,,,,,,,,,,,,,,,,,,,,,,,,,,,,,,,,,,78.03859868100756,,,,,,,,,,85.11849083202601,,,,,,,,,92.39744138892628,,,,
Small states,SST,Borrowed any money (% age 15+),borrow.any,,,,,,,,,,,,,,,,,,,,,,,,,,,,,,,,,,,,,,,,,,,,,,,,,,,,,,,,,,,,,,,,
Small states,SST,Borrowed any money from a formal financial institution or using a mobile money account (% age 15+),fin22a.c.MM.d,,,,,,,,,,,,,,,,,,,,,,,,,,,,,,,,,,,,,,,,,,,,,,,,,,,,,,,,,,,,,,,,
Small states,SST,"Borrowed any money from a formal financial institution or using a mobile money account, female (% age 15+)",fin22a.c.MM.d.1,,,,,,,,,,,,,,,,,,,,,,,,,,,,,,,,,,,,,,,,,,,,,,,,,,,,,,,,,,,,,,,,
Small states,SST,"Borrowed any money from a formal financial institution or using a mobile money account, male (% age 15+)",fin22a.c.MM.d.2,,,,,,,,,,,,,,,,,,,,,,,,,,,,,,,,,,,,,,,,,,,,,,,,,,,,,,,,,,,,,,,,
Small states,SST,"Borrowed any money, female (% age 15+)",borrow.any.1,,,,,,,,,,,,,,,,,,,,,,,,,,,,,,,,,,,,,,,,,,,,,,,,,,,,,,,,,,,,,,,,
Small states,SST,"Borrowed any money, male (% age 15+)",borrow.any.2,,,,,,,,,,,,,,,,,,,,,,,,,,,,,,,,,,,,,,,,,,,,,,,,,,,,,,,,,,,,,,,,
Small states,SST,Borrowed for education or school fees (% age 15+),fin22a.2014,,,,,,,,,,,,,,,,,,,,,,,,,,,,,,,,,,,,,,,,,,,,,,,,,,,,,,,,,,,,,,,,
Small states,SST,"Borrowed for education or school fees, female (% age 15+)",fin22a.2014.1,,,,,,,,,,,,,,,,,,,,,,,,,,,,,,,,,,,,,,,,,,,,,,,,,,,,,,,,,,,,,,,,
Small states,SST,"Borrowed for education or school fees, male (% age 15+)",fin22a.2014.2,,,,,,,,,,,,,,,,,,,,,,,,,,,,,,,,,,,,,,,,,,,,,,,,,,,,,,,,,,,,,,,,
Small states,SST,Borrowed for health or medical purposes (% age 15+),fin20.t.d,,,,,,,,,,,,,,,,,,,,,,,,,,,,,,,,,,,,,,,,,,,,,,,,,,,,,,,,,,,,,,,,
Small states,SST,"Borrowed for health or medical purposes, female (% age 15+)",fin20.t.d.1,,,,,,,,,,,,,,,,,,,,,,,,,,,,,,,,,,,,,,,,,,,,,,,,,,,,,,,,,,,,,,,,
Small states,SST,"Borrowed for health or medical purposes, male (% age 15+)",fin20.t.d.2,,,,,,,,,,,,,,,,,,,,,,,,,,,,,,,,,,,,,,,,,,,,,,,,,,,,,,,,,,,,,,,,
Small states,SST,Borrowed from a formal financial institution (% age 15+),fin22a.c.t.d,,,,,,,,,,,,,,,,,,,,,,,,,,,,,,,,,,,,,,,,,,,,,,,,,,,,,,,,,,,,,,,,
Small states,SST,"Borrowed from a formal financial institution, female (% age 15+)",fin22a.c.t.d.1,,,,,,,,,,,,,,,,,,,,,,,,,,,,,,,,,,,,,,,,,,,,,,,,,,,,,,,,,,,,,,,,
Small states,SST,"Borrowed from a formal financial institution, male (% age 15+)",fin22a.c.t.d.2,,,,,,,,,,,,,,,,,,,,,,,,,,,,,,,,,,,,,,,,,,,,,,,,,,,,,,,,,,,,,,,,
Small states,SST,Borrowed from a savings club (% age 15+),fin22c.t.d,,,,,,,,,,,,,,,,,,,,,,,,,,,,,,,,,,,,,,,,,,,,,,,,,,,,,,,,,,,,,,,,
Small states,SST,"Borrowed from a savings club, female (% age 15+)",fin22c.t.d.1,,,,,,,,,,,,,,,,,,,,,,,,,,,,,,,,,,,,,,,,,,,,,,,,,,,,,,,,,,,,,,,,
Small states,SST,"Borrowed from a savings club, male (% age 15+)",fin22c.t.d.2,,,,,,,,,,,,,,,,,,,,,,,,,,,,,,,,,,,,,,,,,,,,,,,,,,,,,,,,,,,,,,,,
Small states,SST,Borrowed from a store by buying on credit (% age 15+),fin21b.2014,,,,,,,,,,,,,,,,,,,,,,,,,,,,,,,,,,,,,,,,,,,,,,,,,,,,,,,,,,,,,,,,
Small states,SST,"Borrowed from a store by buying on credit, female (% age 15+)",fin21b.2014.1,,,,,,,,,,,,,,,,,,,,,,,,,,,,,,,,,,,,,,,,,,,,,,,,,,,,,,,,,,,,,,,,
Small states,SST,"Borrowed from a store by buying on credit, male (% age 15+)",fin21b.2014.2,,,,,,,,,,,,,,,,,,,,,,,,,,,,,,,,,,,,,,,,,,,,,,,,,,,,,,,,,,,,,,,,
Small states,SST,Borrowed from family or friends (% age 15+),fin22b.t.d,,,,,,,,,,,,,,,,,,,,,,,,,,,,,,,,,,,,,,,,,,,,,,,,,,,,,,,,,,,,,,,,
Small states,SST,"Borrowed from family or friends, female (% age 15+)",fin22b.t.d.1,,,,,,,,,,,,,,,,,,,,,,,,,,,,,,,,,,,,,,,,,,,,,,,,,,,,,,,,,,,,,,,,
Small states,SST,"Borrowed from family or friends, male (% age 15+)",fin22b.t.d.2,,,,,,,,,,,,,,,,,,,,,,,,,,,,,,,,,,,,,,,,,,,,,,,,,,,,,,,,,,,,,,,,
Small states,SST,"Borrowed to start, operate, or expand a farm or business (% age 15+)",fin21.t.d.2017,,,,,,,,,,,,,,,,,,,,,,,,,,,,,,,,,,,,,,,,,,,,,,,,,,,,,,,,,,,,,,,,
Small states,SST,"Borrowed to start, operate, or expand a farm or business, female (% age 15+)",fin21.t.d.2017.1,,,,,,,,,,,,,,,,,,,,,,,,,,,,,,,,,,,,,,,,,,,,,,,,,,,,,,,,,,,,,,,,
Small states,SST,"Borrowed to start, operate, or expand a farm or business, male (% age 15+)",fin21.t.d.2017.2,,,,,,,,,,,,,,,,,,,,,,,,,,,,,,,,,,,,,,,,,,,,,,,,,,,,,,,,,,,,,,,,
Small states,SST,"Can use a mobile money account without help from anyone, including a mobile money agent (% age 15+)",fin13d,,,,,,,,,,,,,,,,,,,,,,,,,,,,,,,,,,,,,,,,,,,,,,,,,,,,,,,,,,,,,,,,
Small states,SST,"Can use a mobile money account without help from anyone, including a mobile money agent (% with a mobile money account, age 15+)",fin13d.s,,,,,,,,,,,,,,,,,,,,,,,,,,,,,,,,,,,,,,,,,,,,,,,,,,,,,,,,,,,,,,,,
Small states,SST,"Can use account at a bank or financial institution without help if opened (% without an account, age 15+)",fin11.1,,,,,,,,,,,,,,,,,,,,,,,,,,,,,,,,,,,,,,,,,,,,,,,,,,,,,,,,,,,,,,,,
Small states,SST,"Cause of death, by communicable diseases and maternal, prenatal and nutrition conditions (% of total)",SH.DTH.COMM.ZS,,,,,,,,,,,,,,,,,,,,,,,,,,,,,,,,,,,,,,,,,27.42450604758652,,,,,,,,,,21.880555797920287,,,,,19.0893054615858,,,,16.966327627003917,,,,
Small states,SST,"Cause of death, by communicable diseases and maternal, prenatal and nutrition conditions, ages 0-4 (% of population ages 0-4)",SH.DTH.COMM.0004.ZS,,,,,,,,,,,,,,,,,,,,,,,,,,,,,,,,,,,,,,,,,83.54464849304301,,,,,,,,,,80.00164981940071,,,,,77.00054710014945,,,,76.16947095513403,,,,
Small states,SST,"Cause of death, by communicable diseases and maternal, prenatal and nutrition conditions, ages 0-4, female (% of female population ages 0-4)",SH.DTH.COMM.0004.FE.ZS,,,,,,,,,,,,,,,,,,,,,,,,,,,,,,,,,,,,,,,,,83.71539028443019,,,,,,,,,,80.18375429602786,,,,,76.9242611416579,,,,76.0366187056536,,,,
Small states,SST,"Cause of death, by communicable diseases and maternal, prenatal and nutrition conditions, ages 0-4, male (% of male population ages 0-4)",SH.DTH.COMM.0004.MA.ZS,,,,,,,,,,,,,,,,,,,,,,,,,,,,,,,,,,,,,,,,,83.40201215188361,,,,,,,,,,79.85222944591013,,,,,77.06225515540706,,,,76.2756478651924,,,,
Small states,SST,"Cause of death, by communicable diseases and maternal, prenatal and nutrition conditions, ages 15-59 (% of population ages 15-59)",SH.DTH.COMM.1559.ZS,,,,,,,,,,,,,,,,,,,,,,,,,,,,,,,,,,,,,,,,,29.732590438050693,,,,,,,,,,26.11813031134293,,,,,22.96713609947505,,,,20.482081464669104,,,,
Small states,SST,"Cause of death, by communicable diseases and maternal, prenatal and nutrition conditions, ages 15-59, female (% of female population ages 15-59)",SH.DTH.COMM.1559.FE.ZS,,,,,,,,,,,,,,,,,,,,,,,,,,,,,,,,,,,,,,,,,37.50681166982827,,,,,,,,,,32.94528422517001,,,,,29.155655273125944,,,,25.64615924909729,,,,
Small states,SST,"Cause of death, by communicable diseases and maternal, prenatal and nutrition conditions, ages 15-59, male (% of male population ages 15-59)",SH.DTH.COMM.1559.MA.ZS,,,,,,,,,,,,,,,,,,,,,,,,,,,,,,,,,,,,,,,,,24.628361527471256,,,,,,,,,,21.819918473670405,,,,,19.416906088105787,,,,17.646222985301748,,,,
Small states,SST,"Cause of death, by communicable diseases and maternal, prenatal and nutrition conditions, ages 5-14 (% of population ages 5-14)",SH.DTH.COMM.0514.ZS,,,,,,,,,,,,,,,,,,,,,,,,,,,,,,,,,,,,,,,,,49.93996972089367,,,,,,,,,,52.486322901647334,,,,,49.532998455316545,,,,44.573795372332846,,,,
Small states,SST,"Cause of death, by communicable diseases and maternal, prenatal and nutrition conditions, ages 5-14, female (% of female population ages 5-14)",SH.DTH.COMM.0514.FE.ZS,,,,,,,,,,,,,,,,,,,,,,,,,,,,,,,,,,,,,,,,,54.217257364093506,,,,,,,,,,56.09440152674698,,,,,54.11914639230723,,,,50.02818593725448,,,,
Small states,SST,"Cause of death, by communicable diseases and maternal, prenatal and nutrition conditions, ages 5-14, male (% of male population ages 5-14)",SH.DTH.COMM.0514.MA.ZS,,,,,,,,,,,,,,,,,,,,,,,,,,,,,,,,,,,,,,,,,47.11875393324615,,,,,,,,,,49.741866301963746,,,,,46.155394626833065,,,,41.38866995726999,,,,
Small states,SST,"Cause of death, by communicable diseases and maternal, prenatal and nutrition conditions, ages 60+ (% of population ages 60+)",SH.DTH.COMM.60UP.ZS,,,,,,,,,,,,,,,,,,,,,,,,,,,,,,,,,,,,,,,,,8.825601286867727,,,,,,,,,,7.980313146197551,,,,,8.372560228050569,,,,8.339460760837484,,,,
Small states,SST,"Cause of death, by communicable diseases and maternal, prenatal and nutrition conditions, ages 60+, female (% of female population ages 60+)",SH.DTH.COMM.60UP.FE.ZS,,,,,,,,,,,,,,,,,,,,,,,,,,,,,,,,,,,,,,,,,8.463437316593142,,,,,,,,,,7.676693282720817,,,,,8.073465107541638,,,,8.211542907924407,,,,
Small states,SST,"Cause of death, by communicable diseases and maternal, prenatal and nutrition conditions, ages 60+, male (% of male population ages 60+)",SH.DTH.COMM.60UP.MA.ZS,,,,,,,,,,,,,,,,,,,,,,,,,,,,,,,,,,,,,,,,,9.19143580325353,,,,,,,,,,8.291265005256134,,,,,8.680564393272542,,,,8.466580210717394,,,,
Small states,SST,"Cause of death, by communicable diseases and maternal, prenatal and nutrition conditions, female (% of female population)",SH.DTH.COMM.FE.ZS,,,,,,,,,,,,,,,,,,,,,,,,,,,,,,,,,,,,,,,,,28.29203188068059,,,,,,,,,,22.43062193129945,,,,,19.38320882689483,,,,17.23445009333653,,,,
Small states,SST,"Cause of death, by communicable diseases and maternal, prenatal and nutrition conditions, male (% of male population)",SH.DTH.COMM.MA.ZS,,,,,,,,,,,,,,,,,,,,,,,,,,,,,,,,,,,,,,,,,26.68029996104322,,,,,,,,,,21.40866595053583,,,,,18.83771296375055,,,,16.741561705801924,,,,
Small states,SST,"Cause of death, by injury (% of total)",SH.DTH.INJR.ZS,,,,,,,,,,,,,,,,,,,,,,,,,,,,,,,,,,,,,,,,,8.745788660211625,,,,,,,,,,8.362688317458417,,,,,8.027328699564373,,,,7.954770848253309,,,,
Small states,SST,"Cause of death, by injury, ages 0-4 (% of population ages 0-4)",SH.DTH.INJR.0004.ZS,,,,,,,,,,,,,,,,,,,,,,,,,,,,,,,,,,,,,,,,,4.82826105011499,,,,,,,,,,5.436258107153984,,,,,6.0061557092059,,,,6.31036254230474,,,,
Small states,SST,"Cause of death, by injury, ages 0-4, female (% of female population ages 0-4)",SH.DTH.INJR.0004.FE.ZS,,,,,,,,,,,,,,,,,,,,,,,,,,,,,,,,,,,,,,,,,4.838746064917575,,,,,,,,,,5.4371101281101755,,,,,6.079763176950025,,,,6.370486541693952,,,,
Small states,SST,"Cause of death, by injury, ages 0-4, male (% of male population ages 0-4)",SH.DTH.INJR.0004.MA.ZS,,,,,,,,,,,,,,,,,,,,,,,,,,,,,,,,,,,,,,,,,4.8195019516668545,,,,,,,,,,5.435559006929814,,,,,5.946614296988851,,,,6.262310811887252,,,,
Small states,SST,"Cause of death, by injury, ages 15-59 (% of population ages 15-59)",SH.DTH.INJR.1559.ZS,,,,,,,,,,,,,,,,,,,,,,,,,,,,,,,,,,,,,,,,,18.733832402696628,,,,,,,,,,17.829717897006994,,,,,17.726202539223443,,,,18.182919448923418,,,,
Small states,SST,"Cause of death, by injury, ages 15-59, female (% of female population ages 15-59)",SH.DTH.INJR.1559.FE.ZS,,,,,,,,,,,,,,,,,,,,,,,,,,,,,,,,,,,,,,,,,10.203661509795865,,,,,,,,,,9.414244081789423,,,,,8.973649837281512,,,,8.947172663651392,,,,
Small states,SST,"Cause of death, by injury, ages 15-59, male (% of male population ages 15-59)",SH.DTH.INJR.1559.MA.ZS,,,,,,,,,,,,,,,,,,,,,,,,,,,,,,,,,,,,,,,,,24.33438628269966,,,,,,,,,,23.127897728512636,,,,,22.912181324807108,,,,23.44252502517461,,,,
Small states,SST,"Cause of death, by injury, ages 5-14 (% of population ages 5-14)",SH.DTH.INJR.0514.ZS,,,,,,,,,,,,,,,,,,,,,,,,,,,,,,,,,,,,,,,,,29.4593299274661,,,,,,,,,,26.23821990158456,,,,,28.376272804555203,,,,31.13491122098197,,,,
Small states,SST,"Cause of death, by injury, ages 5-14, female (% of female population ages 5-14)",SH.DTH.INJR.0514.FE.ZS,,,,,,,,,,,,,,,,,,,,,,,,,,,,,,,,,,,,,,,,,24.316323602637105,,,,,,,,,,21.99110023093041,,,,,23.0678708222622,,,,25.42957859221361,,,,
Small states,SST,"Cause of death, by injury, ages 5-14, male (% of male population ages 5-14)",SH.DTH.INJR.0514.MA.ZS,,,,,,,,,,,,,,,,,,,,,,,,,,,,,,,,,,,,,,,,,33.72027260232112,,,,,,,,,,29.68840156555531,,,,,32.55103198201703,,,,35.52914612462741,,,,
Small states,SST,"Cause of death, by injury, ages 60+ (% of population ages 60+)",SH.DTH.INJR.60UP.ZS,,,,,,,,,,,,,,,,,,,,,,,,,,,,,,,,,,,,,,,,,3.1395660878745892,,,,,,,,,,3.126836577567715,,,,,3.058004062430726,,,,3.2017965440556524,,,,
Small states,SST,"Cause of death, by injury, ages 60+, female (% of female population ages 60+)",SH.DTH.INJR.60UP.FE.ZS,,,,,,,,,,,,,,,,,,,,,,,,,,,,,,,,,,,,,,,,,2.2460433181459623,,,,,,,,,,2.361232811774538,,,,,2.3083093128278818,,,,2.418996408894246,,,,
Small states,SST,"Cause of death, by injury, ages 60+, male (% of male population ages 60+)",SH.DTH.INJR.60UP.MA.ZS,,,,,,,,,,,,,,,,,,,,,,,,,,,,,,,,,,,,,,,,,4.0421447460506,,,,,,,,,,3.9109286048792016,,,,,3.830029714726444,,,,3.979710809184516,,,,
Small states,SST,"Cause of death, by injury, female (% of female population)",SH.DTH.INJR.FE.ZS,,,,,,,,,,,,,,,,,,,,,,,,,,,,,,,,,,,,,,,,,5.1961913110494375,,,,,,,,,,4.8409404809975065,,,,,4.504800430943202,,,,4.4200473384247685,,,,
Small states,SST,"Cause of death, by injury, male (% of male population)",SH.DTH.INJR.MA.ZS,,,,,,,,,,,,,,,,,,,,,,,,,,,,,,,,,,,,,,,,,11.790806861673868,,,,,,,,,,11.38391967158976,,,,,11.04274733838936,,,,10.917914506953908,,,,
Small states,SST,"Cause of death, by non-communicable diseases (% of total)",SH.DTH.NCOM.ZS,,,,,,,,,,,,,,,,,,,,,,,,,,,,,,,,,,,,,,,,,63.82970483033404,,,,,,,,,,69.7567559480915,,,,,72.88336584448635,,,,75.07890177618431,,,,
Small states,SST,"Cause of death, by non-communicable diseases, ages 0-4 (% of population ages 0-4)",SH.DTH.NCOM.0004.ZS,,,,,,,,,,,,,,,,,,,,,,,,,,,,,,,,,,,,,,,,,11.62708994485402,,,,,,,,,,14.562092980237772,,,,,16.99329763173032,,,,17.520167447230396,,,,
Small states,SST,"Cause of death, by non-communicable diseases, ages 0-4, female (% of female population ages 0-4)",SH.DTH.NCOM.0004.FE.ZS,,,,,,,,,,,,,,,,,,,,,,,,,,,,,,,,,,,,,,,,,11.445862910729096,,,,,,,,,,14.37913585973652,,,,,16.99597604764327,,,,17.592895464805853,,,,
Small states,SST,"Cause of death, by non-communicable diseases, ages 0-4, male (% of male population ages 0-4)",SH.DTH.NCOM.0004.MA.ZS,,,,,,,,,,,,,,,,,,,,,,,,,,,,,,,,,,,,,,,,,11.778485574826494,,,,,,,,,,14.712212965096844,,,,,16.991131049139508,,,,17.46204245340749,,,,
Small states,SST,"Cause of death, by non-communicable diseases, ages 15-59 (% of population ages 15-59)",SH.DTH.NCOM.1559.ZS,,,,,,,,,,,,,,,,,,,,,,,,,,,,,,,,,,,,,,,,,51.53357688333503,,,,,,,,,,56.05215151140613,,,,,59.30666016747412,,,,61.33499901443011,,,,
Small states,SST,"Cause of death, by non-communicable diseases, ages 15-59, female (% of female population ages 15-59)",SH.DTH.NCOM.1559.FE.ZS,,,,,,,,,,,,,,,,,,,,,,,,,,,,,,,,,,,,,,,,,52.289527327855915,,,,,,,,,,57.64047169759052,,,,,61.87069470560788,,,,65.40666773984152,,,,
Small states,SST,"Cause of death, by non-communicable diseases, ages 15-59, male (% of male population ages 15-59)",SH.DTH.NCOM.1559.MA.ZS,,,,,,,,,,,,,,,,,,,,,,,,,,,,,,,,,,,,,,,,,51.03725139952488,,,,,,,,,,55.052183338363236,,,,,57.78744295476049,,,,59.01625078200728,,,,
Small states,SST,"Cause of death, by non-communicable diseases, ages 5-14 (% of population ages 5-14)",SH.DTH.NCOM.0514.ZS,,,,,,,,,,,,,,,,,,,,,,,,,,,,,,,,,,,,,,,,,20.60070384233051,,,,,,,,,,21.50818571855237,,,,,22.551457871010903,,,,24.29129404469426,,,,
Small states,SST,"Cause of death, by non-communicable diseases, ages 5-14, female (% of female population ages 5-14)",SH.DTH.NCOM.0514.FE.ZS,,,,,,,,,,,,,,,,,,,,,,,,,,,,,,,,,,,,,,,,,21.63336766214196,,,,,,,,,,22.1835984179607,,,,,23.633686694119213,,,,25.308748808529973,,,,
Small states,SST,"Cause of death, by non-communicable diseases, ages 5-14, male (% of male population ages 5-14)",SH.DTH.NCOM.0514.MA.ZS,,,,,,,,,,,,,,,,,,,,,,,,,,,,,,,,,,,,,,,,,19.74514951033834,,,,,,,,,,20.959508805360425,,,,,21.700345855735875,,,,23.53232885076575,,,,
